{
    "metadata": {
        "integrity_registry_id": "MOXDOP_DATA_INTEGRITY_REGISTRY",
        "version": 1,
        "status": "PRODUCTION",
        "created_at": "2026-08-13",
        "data_contract_registry_id": "MOXDOP_DATA_CONTRACT_REGISTRY",
        "data_contract_registry_version": 1,
        "storage_contract_id": "MOXDOP_DATA_POOL_STORAGE",
        "storage_contract_version": 1,
        "formula_registry_id": "MOXDOP_FORMULA_REGISTRY",
        "formula_registry_version": 1,
        "description": "Integrity check profiles for production GSC/GA4/Google Ads/Meta Ads datasets. References canonical Dataset IDs; does not redefine formulas or datasets.",
        "invariants": [
            "NO_NUMERIC_QUALITY_SCORE",
            "NO_AUTOMATIC_REPAIR",
            "COVERAGE_FROM_COLLECTION_EVIDENCE_NOT_FACT_PRESENCE",
            "ZERO_ROW_SUCCESS_IS_COVERAGE",
            "RAW_ROWS_NOT_EQUAL_NORMALIZED_ROWS_BY_DEFINITION",
            "NON_ADDITIVE_METRICS_NOT_SUMMED",
            "PROVIDER_ASYNC_COMPLETE_NOT_DATASET_COMPLETE",
            "DEFAULT_AUDIT_ZERO_PROVIDER_CALLS",
            "UNVERIFIED_IS_NOT_PASS"
        ]
    },
    "enums": {
        "check_status": [
            "PASS",
            "PASS_WITH_LIMITATION",
            "WARNING",
            "FAIL",
            "UNVERIFIED",
            "NOT_APPLICABLE"
        ],
        "readiness_status": [
            "READY_FOR_REAL_UI",
            "READY_WITH_PROVIDER_LIMITATION",
            "BLOCKED_PARTIAL",
            "BLOCKED_INTEGRITY",
            "BLOCKED_STALE",
            "BLOCKED_CONTRACT",
            "UNVERIFIED"
        ],
        "audit_mode": [
            "LOCAL_INTEGRITY",
            "PROVIDER_RECONCILIATION"
        ],
        "row_accounting_mode": [
            "ONE_TO_ONE",
            "ONE_TO_MANY_TYPED_ACTIONS",
            "FILTERED_CONTRACT_SUBSET",
            "SNAPSHOT_UPSERT",
            "STREAM_BATCH"
        ],
        "coverage_mode": [
            "INTERVAL_SET",
            "SNAPSHOT",
            "NOT_APPLICABLE"
        ]
    },
    "global_policies": {
        "default_audit_mode": "LOCAL_INTEGRITY",
        "provider_reconciliation_opt_in": true,
        "page_render_provider_calls": false,
        "automatic_repair": false,
        "numeric_quality_score": false,
        "zero_fill_missing_dates": false,
        "cross_currency_aggregation": false,
        "ingestion_time_fx": false,
        "timezone_rebucket": false
    },
    "dataset_profiles": [
        {
            "dataset_id": "ga4_property_metadata",
            "provider_or_source": "GA4",
            "storage_disposition": "PHYSICAL_TABLE",
            "physical_table": "ga4_property_metadata",
            "grain": [
                "property_id"
            ],
            "natural_key": [
                "digital_asset_id",
                "property_id"
            ],
            "collection_run_in_natural_key": false,
            "history_mode": "snapshot",
            "coverage_mode": "SNAPSHOT",
            "pagination_mode": "GA4_OFFSET_ROWCOUNT",
            "row_accounting_mode": "SNAPSHOT_UPSERT",
            "timezone_source": "ga4_property_timezone",
            "currency_source": "NOT_APPLICABLE",
            "raw_required": false,
            "request_family_ids": [
                "GA4_RF_PROPERTY_METADATA"
            ],
            "additive_metrics": [],
            "non_additive_metrics": [],
            "freshness_sla_hours": 168,
            "required_checks": [
                "natural_key_duplicates",
                "referential_integrity",
                "provenance",
                "write_receipt_accounting",
                "materialization_reconciliation",
                "contract_completeness",
                "freshness",
                "pagination_completeness",
                "row_accounting",
                "snapshot_semantics"
            ],
            "migration_blocking_checks": [
                "natural_key_duplicates",
                "referential_integrity",
                "unexplained_row_loss",
                "unexplained_row_expansion",
                "coverage_intervals",
                "pagination_completeness",
                "timezone_provenance",
                "currency_provenance",
                "materialization_reconciliation",
                "contract_completeness"
            ],
            "provider_total_reconciliation": {
                "enabled": false,
                "default_mode": "LOCAL_SAME_RUN",
                "forbid_sum_metrics": [],
                "tolerance": null
            }
        },
        {
            "dataset_id": "ga4_property_daily",
            "provider_or_source": "GA4",
            "storage_disposition": "PHYSICAL_TABLE",
            "physical_table": "ga4_property_daily",
            "grain": [
                "property_id",
                "date"
            ],
            "natural_key": [
                "digital_asset_id",
                "property_id",
                "reporting_date"
            ],
            "collection_run_in_natural_key": false,
            "history_mode": "historical",
            "coverage_mode": "INTERVAL_SET",
            "pagination_mode": "GA4_OFFSET_ROWCOUNT",
            "row_accounting_mode": "ONE_TO_ONE",
            "timezone_source": "ga4_property_timezone",
            "currency_source": "NOT_APPLICABLE",
            "raw_required": false,
            "request_family_ids": [
                "GA4_RF_PROPERTY_DAILY"
            ],
            "additive_metrics": [
                "sessions",
                "eventCount",
                "screenPageViews"
            ],
            "non_additive_metrics": [
                "totalUsers",
                "activeUsers",
                "newUsers"
            ],
            "freshness_sla_hours": 48,
            "required_checks": [
                "natural_key_duplicates",
                "referential_integrity",
                "provenance",
                "write_receipt_accounting",
                "materialization_reconciliation",
                "contract_completeness",
                "freshness",
                "pagination_completeness",
                "row_accounting",
                "coverage_intervals",
                "timezone_provenance",
                "non_additive_metric_protection",
                "provider_total_compatibility"
            ],
            "migration_blocking_checks": [
                "natural_key_duplicates",
                "referential_integrity",
                "unexplained_row_loss",
                "unexplained_row_expansion",
                "coverage_intervals",
                "pagination_completeness",
                "timezone_provenance",
                "currency_provenance",
                "materialization_reconciliation",
                "contract_completeness"
            ],
            "provider_total_reconciliation": {
                "enabled": true,
                "default_mode": "LOCAL_SAME_RUN",
                "forbid_sum_metrics": [
                    "totalUsers",
                    "activeUsers",
                    "newUsers"
                ],
                "tolerance": null
            }
        },
        {
            "dataset_id": "ga4_acquisition_channel_daily",
            "provider_or_source": "GA4",
            "storage_disposition": "PHYSICAL_TABLE",
            "physical_table": "ga4_acquisition_channel_daily",
            "grain": [
                "property_id",
                "date",
                "sessionDefaultChannelGroup"
            ],
            "natural_key": [
                "digital_asset_id",
                "property_id",
                "reporting_date",
                "sessionDefaultChannelGroup"
            ],
            "collection_run_in_natural_key": false,
            "history_mode": "historical",
            "coverage_mode": "INTERVAL_SET",
            "pagination_mode": "GA4_OFFSET_ROWCOUNT",
            "row_accounting_mode": "ONE_TO_ONE",
            "timezone_source": "ga4_property_timezone",
            "currency_source": "NOT_APPLICABLE",
            "raw_required": false,
            "request_family_ids": [
                "GA4_RF_CHANNEL_DAILY"
            ],
            "additive_metrics": [
                "sessions",
                "eventCount",
                "screenPageViews"
            ],
            "non_additive_metrics": [
                "totalUsers",
                "activeUsers",
                "newUsers"
            ],
            "freshness_sla_hours": 48,
            "required_checks": [
                "natural_key_duplicates",
                "referential_integrity",
                "provenance",
                "write_receipt_accounting",
                "materialization_reconciliation",
                "contract_completeness",
                "freshness",
                "pagination_completeness",
                "row_accounting",
                "coverage_intervals",
                "timezone_provenance",
                "non_additive_metric_protection",
                "provider_total_compatibility"
            ],
            "migration_blocking_checks": [
                "natural_key_duplicates",
                "referential_integrity",
                "unexplained_row_loss",
                "unexplained_row_expansion",
                "coverage_intervals",
                "pagination_completeness",
                "timezone_provenance",
                "currency_provenance",
                "materialization_reconciliation",
                "contract_completeness"
            ],
            "provider_total_reconciliation": {
                "enabled": true,
                "default_mode": "LOCAL_SAME_RUN",
                "forbid_sum_metrics": [
                    "totalUsers",
                    "activeUsers",
                    "newUsers"
                ],
                "tolerance": null
            }
        },